stockid,stocklong,year,BvBmsy,FvFmsy,MSY,region,country
SNOWCRABNPAC,Snow crab North Pacific,2013,0.385627530364372,0.042386006097064,159.06800000000007,Japan,Japan
SNOWCRABWSJ,Snow crab Sea of Japan West,2013,1.95476858345021,0.300822122571002,5475.840000000001,Japan,Japan
SNOWGROUPSATLC,Snowy grouper Southern Atlantic coast,2012,0.48951048951049,1.07237992031008,189.87376609999995,US Southeast and Gulf,USA
SNROCKPCOAST,Splitnose rockfish Pacific Coast,2008,1.86650485436893,0.0577889447236181,1267.9999999999993,US West Coast,USA
SOUTHHAKECR,Southern hake Chatham Rise,2009,1.24385595345571,0.0767647058823529,4143.999999999995,New Zealand,New Zealand
SOUTHHAKESA,Southern hake Sub-Antarctic,2014,1.43553293190142,0.22,4341,New Zealand,New Zealand
SOUTHHAKEWCSI,Southern hake West Coast South Island,2012,1.40263847670212,0.16,8076.999999999995,New Zealand,New Zealand
SPANMACKSATLC,Spanish mackerel Southern Atlantic coast,2011,1.48805878750765,0.550928925619835,2750.0000000000005,US Southeast and Gulf,USA
SPANMACKSETO,Japanese Spanish mackerel Inland Sea of Japan,2013,0.150834979349973,1.27581189658756,6926.257020999994,Japan,Japan
SPSDOGPCOAST,Spotted spiny dogfish Pacific Coast,2010,1.3512293478588,1.47169811320755,847.9999999999981,US West Coast,USA
SSANDWSJ,Sailfin sandfish Sea of Japan West,2013,1.86696900982615,0.298442975788514,6694.379999999996,Japan,Japan
SSARDCH,Southern sardine Central-Southern Chile,2020,1.298,0.83,17981.50000000001,South America,Chile
SSTHORNHPCOAST,Shortspine thornyhead Pacific Coast,2012,1.85756066714094,0.374,2033.9999999999977,US West Coast,USA
STFLOUNNPCOAST,Starry flounder Northern Pacific Coast,2004,1.23834196891192,0.117889773062187,818.0000000000032,US West Coast,USA
STFLOUNSPCOAST,Starry flounder Southern Pacific Coast,2004,1.5497474745518,0.0747058823623739,396.00000000000057,US West Coast,USA
STMARLINIO,Striped marlin Indian Ocean,2011,0.523,1.32887832711802,4218.000000000001,Indian Ocean,Indonesia
STMARLINNEPAC,Striped marlin Northeast Pacific,2009,1.52,0.0754,2595.999999999998,Pacific Ocean,USA
STMARLINSWPO,Striped marlin Western Pacific Ocean,2011,0.91,0.806148325861262,2080.9999999999995,Pacific Ocean,Japan
STMARLINWCNPAC,Striped marlin Western and Central North Pacific,2009,0.409162286295644,1.24432635142163,5657.000000000004,Pacific Ocean,Japan
SURFMATLC,Atlantic surfclam Mid-Atlantic Coast,2011,1.09053497942387,0.174039276087794,104196.12903225803,US East Coast,USA
SWHITSE,School whiting Southeast Australia,2016,1.96971091319127,0.536455970833066,2070.344825999999,Australia,Australia
SWORDEPAC,Swordfish Eastern Pacific,2012,1.88,1.06,54900.00000000007,Pacific Ocean,USA
SWORDIO,Swordfish Indian Ocean,2012,1.81,0.697,27100.000000000102,Indian Ocean,Indonesia
SWORDMED,Swordfish Mediterranean Sea,2008,0.96,0.954420623864705,14600.000000000007,Mediterranean-Black Sea,Italy
SWORDNATL,Swordfish Northern Atlantic,2012,1.14,0.886805013679955,13700.000000000038,Atlantic Ocean,Spain
SWORDNPAC,Swordfish North Pacific Ocean,2012,1.19,0.56,14920,Pacific Ocean,Japan
SWORDSATL,Swordfish South Atlantic,2012,0.977,0.756546538760694,14210.00000000001,Atlantic Ocean,Spain
TANNERCRABBSAI,Tanner crab Bering Sea and Aleutian Islands,2012,1.10153042179918,0,35957.71144278605,US Alaska,USA
TARAKNZ,Tarakihi Sub-Antarctic,2007,2.22,0.631535479769876,682.0000000000014,New Zealand,New Zealand
TIGERFLATSE,Tiger flathead Southeast Australia,2015,1.36751699066715,5.23789348577188,2854.0580879999893,Australia,Australia
TILEMATLC,Tilefish Mid-Atlantic Coast,2012,0.883691529709229,0.906451607055151,1029.0000000000005,US East Coast,USA
TILESATLC,Tilefish Southern Atlantic coast,2014,0.84819189201514,1.52542372881356,253.9886108000009,US Southeast and Gulf,USA
TREVALLYTRE7,Trevally New Zealand Areas TRE 7,2014,1.28698688392497,0.678,1817.999999999999,New Zealand,New Zealand
VSNAPGM,Vermilion snapper Gulf of Mexico,2014,1.15736040609137,2.32038834951456,1528.6063879999997,US Southeast and Gulf,USA
VSNAPSATLC,Vermilion snapper Southern Atlantic coast,2016,1.13114754098361,0.609756103509816,592.3004558000002,US Southeast and Gulf,USA
WAREHOUESE,Blue warehou Eastern half of Southeast Australia,2008,1.05117168110303,0.0854150869894623,966.6647399999999,Australia,Australia
WAREHOUWSE,Blue warehou Western half of Southeast Australia,2008,2.24965540196346,0.486025791883965,866.7822979000008,Australia,Australia
WHAKEGBGOM,White hake Gulf of Maine / Georges Bank,2016,0.687475765800698,0.358695652173913,4866.9999999999945,US East Coast,USA
WHITVIIbce-k,Whiting Celtic Sea,2011,2.22945714285714,0.5,21966.740088105747,European Union,France
WINDOWGOMGB,Windowpane flounder Gulf of Maine / Georges Bank,2007,0.172857142857143,3.92,699.9999999999987,US East Coast,USA
WINDOWSNEMATL,Windowpane flounder Southern New England /Mid Atlantic,2007,0.561764705882353,1.25850340136054,500.00000000000006,US East Coast,USA
WINFLOUN5Z,Winter flounder Georges Bank,2016,0.519210526315789,0.225000008221154,3499.999999999997,US East Coast,USA
WINFLOUNSNEMATL,Winter flounder Southern New England /Mid Atlantic,2010,0.162158448042876,0.205882350519031,7532,US East Coast,USA
WITFLOUN4RST,Witch flounder Gulf of St. Lawrence,2016,0.514865419847328,0.266414208333333,26199.999999999953,Canada East Coast,Canada
WITFLOUN5Y,Witch flounder Gulf of Maine,2014,0.219571413490974,2.46236559139785,2187.044701986758,US East Coast,USA
WLFLOUNNPAC,Willowy flounder North Pacific,2013,1.04291044776119,0.571493885015433,144.60482960000002,Japan,Japan
WMARLINATL,White marlin Atlantic Ocean,2010,0.322196412028058,0.718003009323296,1239.000000000001,Atlantic Ocean,Taiwan
WPOLLEBS,Walleye pollock Eastern Bering Sea,2014,1.19794736842105,0.352640545144804,1953299.999999999,US Alaska,USA
WPOLLNSO,Walleye pollock Northern Sea of Okhotsk,2010,0.994301434466496,0.685106382978724,966699.9999999983,Other,Russia
WROCKBCW,Widow rockfish British Columbia Waters,2018,1.50237610199376,0.658783783783784,1909.0000000000007,Canada West Coast,Canada
WROCKPCOAST,Widow rockfish Pacific Coast,2014,1.7253662918564,0.1144,7776,US West Coast,USA
YEGROUPGM,Yellowedge grouper Gulf of Mexico,2009,1.66597251145356,0.68,374.9999999999988,US Southeast and Gulf,USA
YELL3LNO,Yellowtail flounder Grand Banks,2014,1.76,0.24,18729.999999999996,Canada East Coast,Canada
YELLCCODGOM,Yellowtail flounder Cape Cod / Gulf of Maine,2016,0.256681034482759,1.1501831417569,1153.9999999999995,US East Coast,USA
YELLGB,Yellowtail flounder Georges Bank,2007,0.220601851851852,1.14173228346457,9255.384615384624,US East Coast,USA
YELLSNEMATL,Yellowtail flounder Southern New England /Mid Atlantic,2016,0.0817204301075269,3.20588231522491,540.9999999999994,US East Coast,USA
YEYEROCKPCOAST,Yelloweye rockfish Pacific Coast,2016,0.677406618057356,0.18786,108.99999999999999,US West Coast,USA
YFINATL,Yellowfin tuna Atlantic Ocean,2010,0.861,0.99,145938.88888888893,Atlantic Ocean,Spain
YFINCWPAC,Yellowfin tuna Central Western Pacific Ocean,2012,1.24,0.728,550090.4024767812,Pacific Ocean,Japan
YFINEIO,Yellowfin tuna Indian Ocean,2015,0.891,1.11,422000,Indian Ocean,Spain
YFINEPAC,Yellowfin tuna Eastern Pacific,2016,0.928,0.916,274960.0000000001,Pacific Ocean,Mexico
YTROCKNPCOAST,Yellowtail rockfish Northern Pacific Coast,2016,1.91666666666667,0.2937,5434.459961000006,US West Coast,USA
